{
  "schema_version": "1.0",
  "benchmark_id": "synthetic-control-paired-mechanics-v1",
  "data_class": "synthetic_fixture",
  "purpose": "mechanics_only",
  "split": "held_out_test",
  "source_snapshot_digest": "sha256:d21eb224a7186b8e35f50640c0b9f8d859e699ef42b074cb11a6d8c75bfe6214",
  "label_guide_version": "synthetic-guide-v1",
  "partition_policy": "identity_connected_v1",
  "records": [
    {
      "record_id": "fixture-record-focus-001-a",
      "gold_cluster_id": "fixture-cluster-focus-001",
      "partition_group_id": "fixture-group-focus-001",
      "split": "held_out_test",
      "language_tag": "lo-LA",
      "script": "Laoo",
      "source_bucket": "fixture-source-a",
      "completeness_bucket": "fixture-complete"
    },
    {
      "record_id": "fixture-record-focus-001-b",
      "gold_cluster_id": "fixture-cluster-focus-001",
      "partition_group_id": "fixture-group-focus-001",
      "split": "held_out_test",
      "language_tag": "lo-LA",
      "script": "Laoo",
      "source_bucket": "fixture-source-b",
      "completeness_bucket": "fixture-partial"
    },
    {
      "record_id": "fixture-record-focus-002-a",
      "gold_cluster_id": "fixture-cluster-focus-002",
      "partition_group_id": "fixture-group-focus-002",
      "split": "held_out_test",
      "language_tag": "en-GB",
      "script": "Latn",
      "source_bucket": "fixture-source-a",
      "completeness_bucket": "fixture-complete"
    },
    {
      "record_id": "fixture-record-focus-002-b",
      "gold_cluster_id": "fixture-cluster-focus-002",
      "partition_group_id": "fixture-group-focus-002",
      "split": "held_out_test",
      "language_tag": "en-GB",
      "script": "Latn",
      "source_bucket": "fixture-source-b",
      "completeness_bucket": "fixture-partial"
    },
    {
      "record_id": "fixture-record-focus-003-a",
      "gold_cluster_id": "fixture-cluster-focus-003",
      "partition_group_id": "fixture-group-focus-003",
      "split": "held_out_test",
      "language_tag": "th-TH",
      "script": "Thai",
      "source_bucket": "fixture-source-a",
      "completeness_bucket": "fixture-complete"
    },
    {
      "record_id": "fixture-record-focus-003-b",
      "gold_cluster_id": "fixture-cluster-focus-003",
      "partition_group_id": "fixture-group-focus-003",
      "split": "held_out_test",
      "language_tag": "th-TH",
      "script": "Thai",
      "source_bucket": "fixture-source-b",
      "completeness_bucket": "fixture-partial"
    },
    {
      "record_id": "fixture-record-focus-004-a",
      "gold_cluster_id": "fixture-cluster-focus-004",
      "partition_group_id": "fixture-group-focus-004",
      "split": "held_out_test",
      "language_tag": "vi-VN",
      "script": "Latn",
      "source_bucket": "fixture-source-a",
      "completeness_bucket": "fixture-complete"
    },
    {
      "record_id": "fixture-record-focus-004-b",
      "gold_cluster_id": "fixture-cluster-focus-004",
      "partition_group_id": "fixture-group-focus-004",
      "split": "held_out_test",
      "language_tag": "vi-VN",
      "script": "Latn",
      "source_bucket": "fixture-source-b",
      "completeness_bucket": "fixture-partial"
    },
    {
      "record_id": "fixture-record-focus-005-a",
      "gold_cluster_id": "fixture-cluster-focus-005",
      "partition_group_id": "fixture-group-focus-005",
      "split": "held_out_test",
      "language_tag": "hi-IN",
      "script": "Deva",
      "source_bucket": "fixture-source-a",
      "completeness_bucket": "fixture-complete"
    },
    {
      "record_id": "fixture-record-focus-005-b",
      "gold_cluster_id": "fixture-cluster-focus-005",
      "partition_group_id": "fixture-group-focus-005",
      "split": "held_out_test",
      "language_tag": "hi-IN",
      "script": "Deva",
      "source_bucket": "fixture-source-b",
      "completeness_bucket": "fixture-partial"
    },
    {
      "record_id": "fixture-record-focus-006-a",
      "gold_cluster_id": "fixture-cluster-focus-006",
      "partition_group_id": "fixture-group-focus-006",
      "split": "held_out_test",
      "language_tag": "km-KH",
      "script": "Khmr",
      "source_bucket": "fixture-source-a",
      "completeness_bucket": "fixture-complete"
    },
    {
      "record_id": "fixture-record-focus-006-b",
      "gold_cluster_id": "fixture-cluster-focus-006",
      "partition_group_id": "fixture-group-focus-006",
      "split": "held_out_test",
      "language_tag": "km-KH",
      "script": "Khmr",
      "source_bucket": "fixture-source-b",
      "completeness_bucket": "fixture-partial"
    },
    {
      "record_id": "fixture-record-focus-007-a",
      "gold_cluster_id": "fixture-cluster-focus-007",
      "partition_group_id": "fixture-group-focus-007",
      "split": "held_out_test",
      "language_tag": "ar",
      "script": "Arab",
      "source_bucket": "fixture-source-a",
      "completeness_bucket": "fixture-complete"
    },
    {
      "record_id": "fixture-record-focus-007-b",
      "gold_cluster_id": "fixture-cluster-focus-007",
      "partition_group_id": "fixture-group-focus-007",
      "split": "held_out_test",
      "language_tag": "ar",
      "script": "Arab",
      "source_bucket": "fixture-source-b",
      "completeness_bucket": "fixture-partial"
    },
    {
      "record_id": "fixture-record-focus-008-a",
      "gold_cluster_id": "fixture-cluster-focus-008",
      "partition_group_id": "fixture-group-focus-008",
      "split": "held_out_test",
      "language_tag": "ru",
      "script": "Cyrl",
      "source_bucket": "fixture-source-a",
      "completeness_bucket": "fixture-complete"
    },
    {
      "record_id": "fixture-record-focus-008-b",
      "gold_cluster_id": "fixture-cluster-focus-008",
      "partition_group_id": "fixture-group-focus-008",
      "split": "held_out_test",
      "language_tag": "ru",
      "script": "Cyrl",
      "source_bucket": "fixture-source-b",
      "completeness_bucket": "fixture-partial"
    }
  ],
  "queries": [
    {
      "query_id": "fixture-query-focus-001",
      "anchor_record_id": "fixture-record-focus-001-a",
      "split": "held_out_test",
      "independent_group_id": "fixture-group-focus-001"
    },
    {
      "query_id": "fixture-query-focus-002",
      "anchor_record_id": "fixture-record-focus-002-a",
      "split": "held_out_test",
      "independent_group_id": "fixture-group-focus-002"
    },
    {
      "query_id": "fixture-query-focus-003",
      "anchor_record_id": "fixture-record-focus-003-a",
      "split": "held_out_test",
      "independent_group_id": "fixture-group-focus-003"
    },
    {
      "query_id": "fixture-query-focus-004",
      "anchor_record_id": "fixture-record-focus-004-a",
      "split": "held_out_test",
      "independent_group_id": "fixture-group-focus-004"
    },
    {
      "query_id": "fixture-query-focus-005",
      "anchor_record_id": "fixture-record-focus-005-a",
      "split": "held_out_test",
      "independent_group_id": "fixture-group-focus-005"
    },
    {
      "query_id": "fixture-query-focus-006",
      "anchor_record_id": "fixture-record-focus-006-a",
      "split": "held_out_test",
      "independent_group_id": "fixture-group-focus-006"
    },
    {
      "query_id": "fixture-query-focus-007",
      "anchor_record_id": "fixture-record-focus-007-a",
      "split": "held_out_test",
      "independent_group_id": "fixture-group-focus-007"
    },
    {
      "query_id": "fixture-query-focus-008",
      "anchor_record_id": "fixture-record-focus-008-a",
      "split": "held_out_test",
      "independent_group_id": "fixture-group-focus-008"
    }
  ],
  "pairs": [
    {
      "pair_id": "fixture-pair-focus-001-match",
      "query_id": "fixture-query-focus-001",
      "candidate_record_id": "fixture-record-focus-001-b",
      "split": "held_out_test",
      "label": "match",
      "label_status": "synthetic_asserted",
      "case_tags": [
        "synthetic-locale-match-control"
      ]
    },
    {
      "pair_id": "fixture-pair-focus-001-nonmatch",
      "query_id": "fixture-query-focus-001",
      "candidate_record_id": "fixture-record-focus-002-a",
      "split": "held_out_test",
      "label": "non_match",
      "label_status": "synthetic_asserted",
      "case_tags": [
        "synthetic-cross-locale-control"
      ]
    },
    {
      "pair_id": "fixture-pair-focus-002-match",
      "query_id": "fixture-query-focus-002",
      "candidate_record_id": "fixture-record-focus-002-b",
      "split": "held_out_test",
      "label": "match",
      "label_status": "synthetic_asserted",
      "case_tags": [
        "synthetic-locale-match-control"
      ]
    },
    {
      "pair_id": "fixture-pair-focus-002-nonmatch",
      "query_id": "fixture-query-focus-002",
      "candidate_record_id": "fixture-record-focus-003-a",
      "split": "held_out_test",
      "label": "non_match",
      "label_status": "synthetic_asserted",
      "case_tags": [
        "synthetic-cross-locale-control"
      ]
    },
    {
      "pair_id": "fixture-pair-focus-003-match",
      "query_id": "fixture-query-focus-003",
      "candidate_record_id": "fixture-record-focus-003-b",
      "split": "held_out_test",
      "label": "match",
      "label_status": "synthetic_asserted",
      "case_tags": [
        "synthetic-locale-match-control"
      ]
    },
    {
      "pair_id": "fixture-pair-focus-003-nonmatch",
      "query_id": "fixture-query-focus-003",
      "candidate_record_id": "fixture-record-focus-004-a",
      "split": "held_out_test",
      "label": "non_match",
      "label_status": "synthetic_asserted",
      "case_tags": [
        "synthetic-cross-locale-control"
      ]
    },
    {
      "pair_id": "fixture-pair-focus-004-match",
      "query_id": "fixture-query-focus-004",
      "candidate_record_id": "fixture-record-focus-004-b",
      "split": "held_out_test",
      "label": "match",
      "label_status": "synthetic_asserted",
      "case_tags": [
        "synthetic-locale-match-control"
      ]
    },
    {